{
  "schema_version": 1,
  "trace_id": "fixture.direct-legible",
  "world_ref": "fixture",
  "artifact_version_ref": null,
  "persona": "progression_optimizer",
  "objective": "reach objective",
  "profile": "authored_adventure",
  "events": [
    {
      "t": 0,
      "position": [
        0,
        64,
        0
      ],
      "kind": "observation",
      "action": null,
      "target": null,
      "success": null,
      "progress_id": null,
      "failure_class": null,
      "notes": null
    },
    {
      "t": 4,
      "position": [
        6,
        64,
        0
      ],
      "kind": "move",
      "action": "walk",
      "target": "marker-a",
      "success": true,
      "progress_id": null,
      "failure_class": null,
      "notes": null
    },
    {
      "t": 8,
      "position": [
        12,
        64,
        0
      ],
      "kind": "progress",
      "action": "activate",
      "target": "switch-a",
      "success": true,
      "progress_id": "p1",
      "failure_class": null,
      "notes": null
    },
    {
      "t": 13,
      "position": [
        20,
        64,
        0
      ],
      "kind": "move",
      "action": "walk",
      "target": "door-b",
      "success": true,
      "progress_id": null,
      "failure_class": null,
      "notes": null
    },
    {
      "t": 18,
      "position": [
        28,
        64,
        0
      ],
      "kind": "objective_complete",
      "action": "enter",
      "target": "goal",
      "success": true,
      "progress_id": "done",
      "failure_class": null,
      "notes": null
    }
  ]
}
